[
  {
    "author": null,
    "kind": "docs",
    "license": "CC-BY-4.0",
    "modified": "2026-10-16",
    "sections": [
      {
        "id": "overview",
        "title": "Overview"
      },
      {
        "id": "measuring-ai-value-starts-with-tokenomics",
        "title": "Measuring AI Value Starts with Tokenomics"
      },
      {
        "id": "why-the-ai-bill-does-not-behave-like-other-technologies",
        "title": "Why the AI Bill Does Not Behave like Other Technologies"
      },
      {
        "id": "three-questions-tokenomics-has-to-answer",
        "title": "Three Questions Tokenomics Has to Answer"
      },
      {
        "id": "where-the-tokenomics-work-happens",
        "title": "Where the Tokenomics Work Happens"
      },
      {
        "id": "terminology-reference",
        "title": "Terminology Reference"
      }
    ],
    "slug": "what-is-tokenomics",
    "status": "Tokenomics Draft Definition v0.5.2",
    "status_date": "September 1 2026",
    "status_source": "page",
    "title": "What Is AI Tokenomics?",
    "url": "https://www.tokeneconomics.com/what-is-ai-tokenomics/",
    "word_count": 1996
  },
  {
    "author": null,
    "kind": "project",
    "license": "CC-BY-4.0",
    "modified": "2026-10-17",
    "sections": [
      {
        "id": "overview",
        "title": "Overview"
      },
      {
        "id": "what-it-is",
        "title": "Tokenomics is an AI stack discipline, not a token discipline."
      },
      {
        "id": "stack",
        "title": "The seven layers rest on one another."
      },
      {
        "id": "table",
        "title": "Which layers set the cost, and which move the class"
      },
      {
        "id": "layers",
        "title": "Where the decisions sit"
      },
      {
        "id": "resources",
        "title": "Further resources"
      }
    ],
    "slug": "seven-layer-stack",
    "status": "Release Candidate (projects index label)",
    "status_date": null,
    "status_source": "registry",
    "title": "The Seven-Layer Tokenomics Stack",
    "url": "https://www.tokeneconomics.com/projects/the-seven-layer-tokenomics-stack/",
    "word_count": 1301
  },
  {
    "author": null,
    "kind": "paper",
    "license": "CC-BY-4.0",
    "modified": "2026-10-16",
    "sections": [
      {
        "id": "overview",
        "title": "Overview"
      },
      {
        "id": "spectrum",
        "title": "The consumption spectrum"
      },
      {
        "id": "l0",
        "title": "L0 Energy"
      },
      {
        "id": "l1",
        "title": "L1 Physical infrastructure"
      },
      {
        "id": "l2",
        "title": "L2 Infrastructure management"
      },
      {
        "id": "l3",
        "title": "L3 Inference stack"
      },
      {
        "id": "l4",
        "title": "L4 Model management and selection"
      },
      {
        "id": "l5",
        "title": "L5 AI access and control"
      },
      {
        "id": "l6",
        "title": "L6 Demand and entry points"
      },
      {
        "id": "measuring",
        "title": "Measuring across the stack"
      },
      {
        "id": "conclusion",
        "title": "Conclusion"
      }
    ],
    "slug": "seven-layer-stack-paper",
    "status": "Release Candidate (projects index label)",
    "status_date": null,
    "status_source": "registry",
    "title": "The Seven-Layer Tokenomics Stack",
    "url": "https://www.tokeneconomics.com/projects/the-seven-layer-tokenomics-stack-paper/",
    "word_count": 5020
  },
  {
    "author": "Dan Neff (Adobe)",
    "kind": "project",
    "license": "CC-BY-4.0",
    "modified": "2026-08-27",
    "sections": [
      {
        "id": "overview",
        "title": "Overview"
      },
      {
        "id": "what",
        "title": "The unit of scarcity has changed. The vocabulary hasn't."
      },
      {
        "id": "notation",
        "title": "The notation: T(n · k · a)"
      },
      {
        "id": "ladder",
        "title": "How token costs scale"
      },
      {
        "id": "savings",
        "title": "The path to 34× savings"
      },
      {
        "id": "concepts",
        "title": "The ideas behind the notation"
      },
      {
        "id": "howto",
        "title": "Putting Big-T to work"
      },
      {
        "id": "resources",
        "title": "Further resources"
      }
    ],
    "slug": "big-t-notation",
    "status": "Published project explainer (no status label)",
    "status_date": null,
    "status_source": "registry",
    "title": "Big-T Notation",
    "url": "https://www.tokeneconomics.com/projects/big-t-notation/",
    "word_count": 2372
  },
  {
    "author": "Dan Neff (Adobe)",
    "kind": "paper",
    "license": "CC-BY-4.0",
    "modified": "2026-10-16",
    "sections": [
      {
        "id": "overview",
        "title": "Overview"
      },
      {
        "id": "abstract",
        "title": "Abstract"
      },
      {
        "id": "the-scarcity-that-shapes-systems",
        "title": "1. The scarcity that shapes systems"
      },
      {
        "id": "big-t-notation-the-framework",
        "title": "2. Big-T Notation: the framework"
      },
      {
        "id": "the-compounding-demand-thesis",
        "title": "3. The compounding-demand thesis"
      },
      {
        "id": "five-levers-for-token-efficiency",
        "title": "4. Five levers for token efficiency"
      },
      {
        "id": "efficiency-and-literacy",
        "title": "5. Efficiency and literacy"
      },
      {
        "id": "reference-architecture-the-token-efficiency-pipeline",
        "title": "6. Reference architecture: the token-efficiency pipeline"
      },
      {
        "id": "assessment-checklist",
        "title": "7. Assessment checklist"
      },
      {
        "id": "conclusion",
        "title": "8. Conclusion"
      }
    ],
    "slug": "big-t-notation-paper",
    "status": "Full paper (projects index label)",
    "status_date": null,
    "status_source": "registry",
    "title": "Big-T Notation Paper",
    "url": "https://www.tokeneconomics.com/projects/big-t-notation-paper/",
    "word_count": 3746
  },
  {
    "author": "Tokenomics Foundation Consumption Working Group",
    "kind": "project",
    "license": "CC-BY-4.0",
    "modified": "2026-10-14",
    "sections": [
      {
        "id": "overview",
        "title": "Overview"
      },
      {
        "id": "tcsimulator",
        "title": "Drag the blocks, watch the money move"
      },
      {
        "id": "tctheonething",
        "title": "Cache hits are almost free wins... except that they aren't free"
      },
      {
        "id": "tcthreerules",
        "title": "Three rules govern every prompt cache you will use"
      },
      {
        "id": "tcmonitoring",
        "title": "Measuring prefix caching"
      },
      {
        "id": "tcmodelswitching",
        "title": "Every model has its own cache (and switching models clears it)"
      },
      {
        "id": "tcaccessmodes",
        "title": "The same model caches very differently depending on how you reach it"
      },
      {
        "id": "tcprovidersnapshot",
        "title": "The frontier providers agree on almost nothing"
      }
    ],
    "slug": "cache-explainer",
    "status": "Release Candidate 1",
    "status_date": "2026-09-22",
    "status_source": "page",
    "title": "AI Tokenomics Prompt Cache Explainer",
    "url": "https://www.tokeneconomics.com/projects/cache-explainer/",
    "word_count": 3054
  },
  {
    "author": null,
    "kind": "project",
    "license": "CC-BY-4.0",
    "modified": "2026-10-14",
    "sections": [
      {
        "id": "overview",
        "title": "Overview"
      },
      {
        "id": "wp-what",
        "title": "What this is"
      },
      {
        "id": "wp-stages",
        "title": "The three stages"
      },
      {
        "id": "wp-where",
        "title": "Where the enterprise sits"
      },
      {
        "id": "wp-personas",
        "title": "The personas"
      },
      {
        "id": "wp-allied",
        "title": "Allied personas"
      },
      {
        "id": "wp-raci",
        "title": "Responsibility by lifecycle stage"
      },
      {
        "id": "wp-motion",
        "title": "The operating model in motion"
      },
      {
        "id": "wp-refs",
        "title": "References"
      }
    ],
    "slug": "personas-operating-model",
    "status": "Release Candidate 2",
    "status_date": "2026-09-04",
    "status_source": "page",
    "title": "AI Tokenomics Personas and Operating Model",
    "url": "https://www.tokeneconomics.com/projects/personas-and-operating-model-map/",
    "word_count": 4975
  },
  {
    "author": null,
    "kind": "project",
    "license": "CC-BY-4.0",
    "modified": "2026-10-14",
    "sections": [
      {
        "id": "overview",
        "title": "Overview"
      },
      {
        "id": "vfstep1",
        "title": "Business Mission: Value starts with why the business exists"
      },
      {
        "id": "vfstep2",
        "title": "Financial Treatment: Different AI uses require different treatment"
      },
      {
        "id": "vfstep3",
        "title": "Outcome Categories: The value classification"
      },
      {
        "id": "vfstep4",
        "title": "Measurement and Conversion: The claim chain"
      },
      {
        "id": "vf-real-world-example-an-ai-code-review-assistant-end-to-end-value-classification",
        "title": "Real World Example: An AI Code Review Assistant, End to End Value Classification"
      },
      {
        "id": "vf-what-comes-next-marrying-total-cost-of-ai-to-value-outcomes",
        "title": "What comes next: marrying total cost of AI to value outcomes"
      }
    ],
    "slug": "value-classification",
    "status": "Release Candidate 2",
    "status_date": "2026-09-16",
    "status_source": "page",
    "title": "Classifying and Measuring Realized Value from AI",
    "url": "https://www.tokeneconomics.com/projects/ai-value-classification/",
    "word_count": 3880
  },
  {